{
  "version": "1.0.0",
  "lastUpdated": "2026-02-18T19:36:58.000Z",
  "nodes": [
    {
      "id": "ahu-v1",
      "type": "template",
      "name": "ahu-v1"
    },
    {
      "id": "air-handling-unit",
      "type": "equipment",
      "name": "Air Handling Unit"
    },
    {
      "id": "air-separator",
      "type": "equipment",
      "name": "Air Separator"
    },
    {
      "id": "air-source-heat-pump",
      "type": "equipment",
      "name": "Air Source Heat Pump"
    },
    {
      "id": "air-turnover-unit",
      "type": "equipment",
      "name": "Air Turnover Unit"
    },
    {
      "id": "apparent-power-kva",
      "type": "point",
      "name": "Apparent Power"
    },
    {
      "id": "automatic-transfer-switch",
      "type": "equipment",
      "name": "Automatic Transfer Switch"
    },
    {
      "id": "baseboard-heater",
      "type": "equipment",
      "name": "Baseboard Heater"
    },
    {
      "id": "blower-coil-unit",
      "type": "equipment",
      "name": "Blower Coil Unit"
    },
    {
      "id": "boiler",
      "type": "equipment",
      "name": "Boiler"
    },
    {
      "id": "boiler-alarm",
      "type": "point",
      "name": "Boiler Alarm"
    },
    {
      "id": "boiler-command",
      "type": "point",
      "name": "Boiler Command"
    },
    {
      "id": "boiler-feedback",
      "type": "point",
      "name": "Boiler Feedback"
    },
    {
      "id": "boiler-output",
      "type": "point",
      "name": "Boiler Output"
    },
    {
      "id": "boiler-pump-alarm",
      "type": "point",
      "name": "Boiler Pump Alarm"
    },
    {
      "id": "boiler-pump-command",
      "type": "point",
      "name": "Boiler Pump Command"
    },
    {
      "id": "boiler-pump-feedback",
      "type": "point",
      "name": "Boiler Pump Feedback"
    },
    {
      "id": "boiler-pump-output",
      "type": "point",
      "name": "Boiler Pump Output"
    },
    {
      "id": "boiler-pump-status",
      "type": "point",
      "name": "Boiler Pump Status"
    },
    {
      "id": "boiler-status",
      "type": "point",
      "name": "Boiler Status"
    },
    {
      "id": "boiler-v1",
      "type": "template",
      "name": "boiler-v1"
    },
    {
      "id": "btu-meter",
      "type": "equipment",
      "name": "BTU Meter"
    },
    {
      "id": "building-pressure",
      "type": "point",
      "name": "Building Pressure"
    },
    {
      "id": "building-pressure-setpoint",
      "type": "point",
      "name": "Building Pressure Setpoint"
    },
    {
      "id": "bypass-valve-closed",
      "type": "point",
      "name": "Bypass Valve Closed"
    },
    {
      "id": "bypass-valve-feedback",
      "type": "point",
      "name": "Bypass Valve Feedback"
    },
    {
      "id": "bypass-valve-open",
      "type": "point",
      "name": "Bypass Valve Open"
    },
    {
      "id": "bypass-valve-output",
      "type": "point",
      "name": "Bypass Valve Output"
    },
    {
      "id": "chilled-beam",
      "type": "equipment",
      "name": "Chilled Beam"
    },
    {
      "id": "chilled-water-differential-pressure",
      "type": "point",
      "name": "Chilled Water Differential Pressure"
    },
    {
      "id": "chilled-water-differential-pressure-setpoint",
      "type": "point",
      "name": "Chilled Water Differential Pressure Setpoint"
    },
    {
      "id": "chilled-water-flow",
      "type": "point",
      "name": "Chilled Water Flow"
    },
    {
      "id": "chilled-water-pump-alarm",
      "type": "point",
      "name": "Chilled Water Pump Alarm"
    },
    {
      "id": "chilled-water-pump-command",
      "type": "point",
      "name": "Chilled Water Pump Command"
    },
    {
      "id": "chilled-water-pump-feedback",
      "type": "point",
      "name": "Chilled Water Pump Feedback"
    },
    {
      "id": "chilled-water-pump-output",
      "type": "point",
      "name": "Chilled Water Pump Output"
    },
    {
      "id": "chilled-water-pump-status",
      "type": "point",
      "name": "Chilled Water Pump Status"
    },
    {
      "id": "chilled-water-return-temperature",
      "type": "point",
      "name": "Chilled Water Return Temperature"
    },
    {
      "id": "chilled-water-supply-temperature",
      "type": "point",
      "name": "Chilled Water Supply Temperature"
    },
    {
      "id": "chilled-water-supply-temperature-setpoint",
      "type": "point",
      "name": "Chilled Water Supply Temperature Setpoint"
    },
    {
      "id": "chilled-water-valve-closed",
      "type": "point",
      "name": "Chilled Water Valve Closed"
    },
    {
      "id": "chilled-water-valve-open",
      "type": "point",
      "name": "Chilled Water Valve Open"
    },
    {
      "id": "chiller",
      "type": "equipment",
      "name": "Chiller"
    },
    {
      "id": "chiller-alarm",
      "type": "point",
      "name": "Chiller Alarm"
    },
    {
      "id": "chiller-command",
      "type": "point",
      "name": "Chiller Command"
    },
    {
      "id": "chiller-enable",
      "type": "point",
      "name": "Chiller Enable"
    },
    {
      "id": "chiller-entering-temperature",
      "type": "point",
      "name": "Chiller Entering Temperature"
    },
    {
      "id": "chiller-leaving-temperature",
      "type": "point",
      "name": "Chiller Leaving Temperature"
    },
    {
      "id": "chiller-status",
      "type": "point",
      "name": "Chiller Status"
    },
    {
      "id": "chiller-v1",
      "type": "template",
      "name": "chiller-v1"
    },
    {
      "id": "city-water-temperature",
      "type": "point",
      "name": "City Water Temperature"
    },
    {
      "id": "co2-setpoint",
      "type": "point",
      "name": "CO2 Setpoint"
    },
    {
      "id": "communication-loss-alarm",
      "type": "point",
      "name": "Communication Loss Alarm"
    },
    {
      "id": "computer-room-air-conditioner",
      "type": "equipment",
      "name": "Computer Room Air Conditioner"
    },
    {
      "id": "computer-room-air-handler",
      "type": "equipment",
      "name": "Computer Room Air Handler"
    },
    {
      "id": "condenser-water-flow",
      "type": "point",
      "name": "Condenser Water Flow"
    },
    {
      "id": "condenser-water-pump-alarm",
      "type": "point",
      "name": "Condenser Water Pump Alarm"
    },
    {
      "id": "condenser-water-pump-command",
      "type": "point",
      "name": "Condenser Water Pump Command"
    },
    {
      "id": "condenser-water-pump-feedback",
      "type": "point",
      "name": "Condenser Water Pump Feedback"
    },
    {
      "id": "condenser-water-pump-output",
      "type": "point",
      "name": "Condenser Water Pump Output"
    },
    {
      "id": "condenser-water-pump-status",
      "type": "point",
      "name": "Condenser Water Pump Status"
    },
    {
      "id": "condenser-water-return-temperature",
      "type": "point",
      "name": "Condenser Water Return Temperature"
    },
    {
      "id": "condenser-water-supply-temperature",
      "type": "point",
      "name": "Condenser Water Supply Temperature"
    },
    {
      "id": "condenser-water-supply-temperature-setpoint",
      "type": "point",
      "name": "Condenser Water Supply Temperature Setpoint"
    },
    {
      "id": "condenser-water-valve-closed",
      "type": "point",
      "name": "Condenser Water Valve Closed"
    },
    {
      "id": "condenser-water-valve-open",
      "type": "point",
      "name": "Condenser Water Valve Open"
    },
    {
      "id": "condensing-unit",
      "type": "equipment",
      "name": "Condensing Unit"
    },
    {
      "id": "constant-air-volume-box",
      "type": "equipment",
      "name": "Constant Air Volume Box"
    },
    {
      "id": "cooling-enable",
      "type": "point",
      "name": "Cooling Enable"
    },
    {
      "id": "cooling-outdoor-air-lockout-setpoint",
      "type": "point",
      "name": "Cooling Outdoor Air Lockout Setpoint"
    },
    {
      "id": "cooling-tower",
      "type": "equipment",
      "name": "Cooling Tower"
    },
    {
      "id": "cooling-tower-alarm",
      "type": "point",
      "name": "Cooling Tower Alarm"
    },
    {
      "id": "cooling-tower-basin-temperature",
      "type": "point",
      "name": "Cooling Tower Basin Temperature"
    },
    {
      "id": "cooling-tower-command",
      "type": "point",
      "name": "Cooling Tower Command"
    },
    {
      "id": "cooling-tower-enable",
      "type": "point",
      "name": "Cooling Tower Enable"
    },
    {
      "id": "cooling-tower-feedback",
      "type": "point",
      "name": "Cooling Tower Feedback"
    },
    {
      "id": "cooling-tower-isolation-valve",
      "type": "point",
      "name": "Cooling Tower Isolation Valve"
    },
    {
      "id": "cooling-tower-output",
      "type": "point",
      "name": "Cooling Tower Output"
    },
    {
      "id": "cooling-tower-status",
      "type": "point",
      "name": "Cooling Tower Status"
    },
    {
      "id": "cooling-tower-v1",
      "type": "template",
      "name": "cooling-tower-v1"
    },
    {
      "id": "cooling-valve-closed",
      "type": "point",
      "name": "Cooling Valve Closed"
    },
    {
      "id": "cooling-valve-feedback",
      "type": "point",
      "name": "Cooling Valve Feedback"
    },
    {
      "id": "cooling-valve-open",
      "type": "point",
      "name": "Cooling Valve Open"
    },
    {
      "id": "cooling-valve-output",
      "type": "point",
      "name": "Cooling Valve Output"
    },
    {
      "id": "daylight-illuminance",
      "type": "point",
      "name": "Daylight Illuminance"
    },
    {
      "id": "dedicated-outdoor-air-system",
      "type": "equipment",
      "name": "Dedicated Outdoor Air System"
    },
    {
      "id": "dehumidifier",
      "type": "equipment",
      "name": "Dehumidifier"
    },
    {
      "id": "dewpoint-temperature",
      "type": "point",
      "name": "Dew Point Temperature"
    },
    {
      "id": "discharge-air-flow",